{
  "schema_version": 1,
  "listener": "api",
  "route_group": "/api/v1/devices",
  "wave": 1,
  "description": "The viewer's own device registry: list, forget, and clear device-scoped settings.",
  "rows": [
    {
      "listener": "api",
      "method": "GET",
      "path": "/api/v1/devices/",
      "registration_index": 0,
      "not_applicable": {
        "pagination": "Unpaged per-profile device list.",
        "raw_protocol": "Plain JSON request/response; no ranges, redirects, multipart, or upgrades."
      },
      "scenarios": [
        {
          "id": "devices_list.ok",
          "category": "status_headers",
          "description": "The active profile's devices: 200 JSON.",
          "principal": {
            "class": "primary_profile"
          },
          "request": {
            "path": "/api/v1/devices/"
          },
          "expect": {
            "status": 200,
            "headers": [
              {
                "name": "Content-Type",
                "op": "equals",
                "value": "application/json"
              }
            ],
            "body": [
              {
                "pointer": "",
                "op": "keys_equal",
                "value": [
                  "devices"
                ]
              }
            ]
          },
          "v2_expectation": {
            "kind": "intentional_difference",
            "summary": "Same device visibility and meaning in the bounded items/page envelope with canonical UTC timestamps.",
            "recorded_in": "internal/scenariocatalog/executor/pairing_test.go",
            "operation_id": "listDevices",
            "method": "GET",
            "request": {
              "path": "/api/v2/devices"
            },
            "expect": {
              "status": 200,
              "headers": [
                {
                  "name": "Content-Type",
                  "op": "equals",
                  "value": "application/json"
                },
                {
                  "name": "Cache-Control",
                  "op": "equals",
                  "value": "no-store"
                }
              ],
              "body": [
                {
                  "pointer": "",
                  "op": "keys_equal",
                  "value": [
                    "items",
                    "page"
                  ]
                },
                {
                  "pointer": "/page",
                  "op": "keys_equal",
                  "value": [
                    "has_more"
                  ]
                },
                {
                  "pointer": "/page/has_more",
                  "op": "equals",
                  "value": false
                }
              ]
            }
          }
        },
        {
          "id": "devices_list.own_only",
          "category": "data_meaning",
          "description": "By default only the declared profile's devices appear (two of the household's three).",
          "principal": {
            "class": "primary_profile"
          },
          "request": {
            "path": "/api/v1/devices/"
          },
          "expect": {
            "status": 200,
            "body": [
              {
                "pointer": "/devices",
                "op": "length",
                "value": 2
              },
              {
                "pointer": "/devices",
                "op": "every",
                "value": {
                  "pointer": "/profile_id",
                  "op": "equals",
                  "value": "${profile_primary}"
                }
              },
              {
                "pointer": "/devices/0/profile_name",
                "op": "equals",
                "value": "Fixture Parent"
              },
              {
                "pointer": "/devices/0/changed_count",
                "op": "equals",
                "value": 0
              }
            ]
          },
          "v2_expectation": {
            "kind": "intentional_difference",
            "summary": "Same device visibility and meaning in the bounded items/page envelope with canonical UTC timestamps.",
            "recorded_in": "internal/scenariocatalog/executor/pairing_test.go",
            "operation_id": "listDevices",
            "method": "GET",
            "request": {
              "path": "/api/v2/devices"
            },
            "expect": {
              "status": 200,
              "headers": [
                {
                  "name": "Content-Type",
                  "op": "equals",
                  "value": "application/json"
                },
                {
                  "name": "Cache-Control",
                  "op": "equals",
                  "value": "no-store"
                }
              ],
              "body": [
                {
                  "pointer": "/items",
                  "op": "length",
                  "value": 2
                },
                {
                  "pointer": "/items",
                  "op": "every",
                  "value": {
                    "pointer": "/profile_id",
                    "op": "equals",
                    "value": "${profile_primary}"
                  }
                },
                {
                  "pointer": "/items/0/profile_name",
                  "op": "equals",
                  "value": "Fixture Parent"
                },
                {
                  "pointer": "/items/0/changed_count",
                  "op": "equals",
                  "value": 0
                },
                {
                  "pointer": "/page",
                  "op": "keys_equal",
                  "value": [
                    "has_more"
                  ]
                },
                {
                  "pointer": "/page/has_more",
                  "op": "equals",
                  "value": false
                }
              ]
            }
          }
        },
        {
          "id": "devices_list.current_device",
          "category": "data_meaning",
          "description": "is_current_device marks the device named by X-Silo-Device-Id.",
          "principal": {
            "class": "primary_profile"
          },
          "request": {
            "path": "/api/v1/devices/",
            "headers": {
              "X-Silo-Device-Id": "${device_b}"
            }
          },
          "expect": {
            "status": 200,
            "body": [
              {
                "pointer": "/devices/0/is_current_device",
                "op": "equals",
                "value": true
              },
              {
                "pointer": "/devices/0/device_id",
                "op": "equals",
                "value": "${device_b}"
              }
            ]
          },
          "v2_expectation": {
            "kind": "intentional_difference",
            "summary": "Same device visibility and meaning in the bounded items/page envelope with canonical UTC timestamps.",
            "recorded_in": "internal/scenariocatalog/executor/pairing_test.go",
            "operation_id": "listDevices",
            "method": "GET",
            "request": {
              "path": "/api/v2/devices",
              "headers": {
                "X-Silo-Device-Id": "${device_b}"
              }
            },
            "expect": {
              "status": 200,
              "headers": [
                {
                  "name": "Content-Type",
                  "op": "equals",
                  "value": "application/json"
                },
                {
                  "name": "Cache-Control",
                  "op": "equals",
                  "value": "no-store"
                }
              ],
              "body": [
                {
                  "pointer": "/items/0/is_current_device",
                  "op": "equals",
                  "value": true
                },
                {
                  "pointer": "/items/0/device_id",
                  "op": "equals",
                  "value": "${device_b}"
                },
                {
                  "pointer": "/page",
                  "op": "keys_equal",
                  "value": [
                    "has_more"
                  ]
                },
                {
                  "pointer": "/page/has_more",
                  "op": "equals",
                  "value": false
                },
                {
                  "pointer": "/items/1/is_current_device",
                  "op": "equals",
                  "value": false
                }
              ]
            }
          }
        },
        {
          "id": "devices_list.sorted",
          "category": "sorting",
          "description": "Newest last_seen first, then device_id ascending as the tie-breaker.",
          "principal": {
            "class": "primary_profile"
          },
          "request": {
            "path": "/api/v1/devices/"
          },
          "expect": {
            "status": 200,
            "body": [
              {
                "pointer": "/devices",
                "op": "length",
                "value": 2
              },
              {
                "pointer": "/devices",
                "op": "sorted",
                "value": {
                  "by": "/last_seen_at",
                  "direction": "desc",
                  "then_by": "/device_id",
                  "then_direction": "asc"
                }
              },
              {
                "pointer": "/devices",
                "op": "unique_by",
                "value": "/device_id"
              }
            ]
          },
          "v2_expectation": {
            "kind": "intentional_difference",
            "summary": "Same device visibility and meaning in the bounded items/page envelope with canonical UTC timestamps.",
            "recorded_in": "internal/scenariocatalog/executor/pairing_test.go",
            "operation_id": "listDevices",